{"run_id":"baseline_a1","phase":"phase0","parent_commit":"75700cb8d599321e120a16abd13d8382dc97abaf","commit":"1f0fac01be2ebd56409cabc4ad2cdc3d53ac150e","change_type":"baseline","change_summary":"Unmodified baseline run with seed 1337","env":{"python":"/Users/sanilbaweja/Projects/parameter-golf/.venv/bin/python","seed":1337,"val_loss_every":0,"log_path":"logs/autoresearch/baseline_a1.log"},"code_fingerprint":"train_gpt_mlx.py@75700cb8d599321e120a16abd13d8382dc97abaf","train_loss":0.0,"val_loss":0.0,"val_bpb":0.0,"train_time_ms":0.0,"step_avg_ms":0.0,"tok_s":0.0,"artifact_raw_bytes":0,"artifact_int8_bytes":0,"status":"crash","reason":"MLX aborted during Metal device initialization before training started (NSRangeException in libmlx.dylib while importing mlx.core)."}
{"run_id":"baseline_a1","phase":"phase0","parent_commit":"75700cb8d599321e120a16abd13d8382dc97abaf","commit":"c2f461379d6f9d939072568a7ee27f758e2e1e4c","change_type":"baseline","change_summary":"Unmodified baseline run with seed 1337 on unsandboxed Metal path","env":{"python":"python3","seed":1337,"val_loss_every":0,"log_path":"logs/baseline_a1.txt","sandbox":"escalated"},"code_fingerprint":"train_gpt_mlx.py@75700cb8d599321e120a16abd13d8382dc97abaf","train_loss":16.4594,"val_loss":16.77104358,"val_bpb":9.93275667,"train_time_ms":671899.0,"step_avg_ms":74655.42,"tok_s":6702.0,"artifact_raw_bytes":67212188,"artifact_int8_bytes":5040849,"status":"keep","reason":"Phase 0 baseline reference run completed successfully."}
{"run_id":"baseline_a2","phase":"phase0","parent_commit":"c2f461379d6f9d939072568a7ee27f758e2e1e4c","commit":"8aff8d93f52163c8d57f12cb83248f5156293845","change_type":"baseline","change_summary":"Second unmodified baseline run with seed 1337 on warmed MLX path","env":{"python":"python3","seed":1337,"val_loss_every":0,"log_path":"logs/baseline_a2.txt","sandbox":"escalated"},"code_fingerprint":"train_gpt_mlx.py@75700cb8d599321e120a16abd13d8382dc97abaf","train_loss":14.0011,"val_loss":12.93875393,"val_bpb":7.66305888,"train_time_ms":610290.0,"step_avg_ms":30514.48,"tok_s":21065.0,"artifact_raw_bytes":67212188,"artifact_int8_bytes":5108838,"status":"keep","reason":"Phase 0 repeat baseline completed successfully; result reflects a warmed MLX compile/runtime path."}
{"run_id":"baseline_b1","phase":"phase0","parent_commit":"8aff8d93f52163c8d57f12cb83248f5156293845","commit":"714fe1052582df739c86fbf40524840e7b9c5fad","change_type":"baseline","change_summary":"Second-seed baseline attempt with seed 1338","env":{"python":"python3","seed":1338,"val_loss_every":0,"sandbox":"sandbox_fallback"},"code_fingerprint":"train_gpt_mlx.py@75700cb8d599321e120a16abd13d8382dc97abaf","train_loss":0.0,"val_loss":0.0,"val_bpb":0.0,"train_time_ms":0.0,"step_avg_ms":0.0,"tok_s":0.0,"artifact_raw_bytes":0,"artifact_int8_bytes":0,"status":"crash","reason":"This command was not covered by the prior unsandboxed approval and ran inside the sandbox, where MLX could not enumerate Metal devices."}
{"run_id":"baseline_a3","phase":"phase0","parent_commit":"714fe1052582df739c86fbf40524840e7b9c5fad","commit":"8382f619674b020a31ff316338d4f2556498c4bb","change_type":"baseline","change_summary":"Third unmodified baseline run with seed 1337 on a further warmed MLX path","env":{"python":"python3","seed":1337,"val_loss_every":0,"log_path":"logs/baseline_a1.txt","sandbox":"approved_exact_command"},"code_fingerprint":"train_gpt_mlx.py@75700cb8d599321e120a16abd13d8382dc97abaf","train_loss":13.9928,"val_loss":11.35216889,"val_bpb":6.72339385,"train_time_ms":601598.0,"step_avg_ms":20053.28,"tok_s":26510.0,"artifact_raw_bytes":67212188,"artifact_int8_bytes":5130156,"status":"keep","reason":"Phase 0 repeat baseline completed successfully; warmed runtime state allowed 30 steps before the wallclock cap."}
{"run_id":"mlx_smoke","phase":"proxy_baseline","parent_commit":"7b68fe0df0b9090663a112a0e736475f63bcdaac","commit":"7b68fe0df0b9090663a112a0e736475f63bcdaac","change_type":"baseline","change_summary":"README smoke configuration proxy baseline","env":{"python":"python3","iterations":200,"train_batch_tokens":8192,"val_batch_size":8192,"val_loss_every":0,"log_path":"logs/autoresearch/readme_smoke.log","sandbox":"approved_exact_command"},"code_fingerprint":"train_gpt_mlx.py@75700cb8d599321e120a16abd13d8382dc97abaf","train_loss":3.8326,"val_loss":3.89151048,"val_bpb":2.30477171,"train_time_ms":200313.0,"step_avg_ms":1001.57,"tok_s":7846.0,"artifact_raw_bytes":0,"artifact_int8_bytes":9897212,"status":"maybe","reason":"Short local screening baseline using the README smoke configuration; useful for rapid proxy comparisons but not a submission-grade metric."}
{"run_id":"mlx_smoke","phase":"proxy_screen","parent_commit":"7b68fe0df0b9090663a112a0e736475f63bcdaac","commit":"12641775103ed2b14f0c4010532542c7e129bd0c","change_type":"scalar_config","change_summary":"Lower QK_GAIN_INIT default from 1.5 to 1.25 for smoke screening","env":{"python":"python3","iterations":200,"train_batch_tokens":8192,"val_batch_size":8192,"val_loss_every":0,"qk_gain_init":1.25,"log_path":"logs/mlx_smoke.txt","sandbox":"approved_exact_command"},"code_fingerprint":"train_gpt_mlx.py@dirty-qk_gain_init_1p25","train_loss":3.9010,"val_loss":4.01621880,"val_bpb":2.37863099,"train_time_ms":102916.0,"step_avg_ms":514.58,"tok_s":14130.0,"artifact_raw_bytes":67212188,"artifact_int8_bytes":11127690,"status":"discard","reason":"Proxy smoke screen regressed versus the smoke baseline on both val_bpb and compressed artifact size."}
{"run_id":"mlx_smoke","phase":"proxy_baseline_fast","parent_commit":"12641775103ed2b14f0c4010532542c7e129bd0c","commit":"d34bf7b6db28cb8f2ace6a14df6a4f8793145d1d","change_type":"baseline","change_summary":"Fast smoke proxy baseline with capped validation and skipped quantized roundtrip eval","env":{"python":"python3","iterations":200,"train_batch_tokens":8192,"val_batch_size":8192,"val_loss_every":0,"proxy_val_batches":2048,"proxy_skip_quant_eval":1,"log_path":"logs/mlx_smoke.txt","sandbox":"approved_exact_command"},"code_fingerprint":"train_gpt_mlx.py@dirty-proxy-eval-cap","train_loss":3.9125,"val_loss":4.06830307,"val_bpb":2.44043721,"train_time_ms":84813.0,"step_avg_ms":424.07,"tok_s":8349.0,"artifact_raw_bytes":67212188,"artifact_int8_bytes":11262005,"status":"maybe","reason":"New short-screen baseline for local iteration; not directly comparable to the earlier full-validation smoke baseline."}
{"run_id":"mlx_smoke","phase":"proxy_screen_fast","parent_commit":"d34bf7b6db28cb8f2ace6a14df6a4f8793145d1d","commit":"56c1845aeb081de3d7c6968d7524121f9c979b47","change_type":"scalar_config","change_summary":"Raise QK_GAIN_INIT default from 1.5 to 1.75 for fast proxy screening","env":{"python":"python3","iterations":200,"train_batch_tokens":8192,"val_batch_size":8192,"val_loss_every":0,"qk_gain_init":1.75,"proxy_val_batches":2048,"proxy_skip_quant_eval":1,"log_path":"logs/mlx_smoke.txt","sandbox":"approved_exact_command"},"code_fingerprint":"train_gpt_mlx.py@dirty-proxy-eval-cap-qk_gain_init_1p75","train_loss":3.9023,"val_loss":4.01961184,"val_bpb":2.41122899,"train_time_ms":100603.0,"step_avg_ms":503.02,"tok_s":9801.0,"artifact_raw_bytes":67212188,"artifact_int8_bytes":11239422,"status":"maybe","reason":"Fast proxy screen improved versus the fast proxy baseline, but it still needs confirmation under the new short-screen regime."}
{"run_id":"mlx_smoke","phase":"proxy_screen_fast_confirm","parent_commit":"56c1845aeb081de3d7c6968d7524121f9c979b47","commit":"a48087dd91db1c2ea6e41f8bd0d0cd09320cbdb8","change_type":"scalar_config","change_summary":"Confirmation rerun for QK_GAIN_INIT=1.75 under the fast proxy harness","env":{"python":"python3","iterations":200,"train_batch_tokens":8192,"val_batch_size":8192,"val_loss_every":0,"qk_gain_init":1.75,"proxy_val_batches":2048,"proxy_skip_quant_eval":1,"log_path":"logs/mlx_smoke.txt","sandbox":"approved_exact_command"},"code_fingerprint":"train_gpt_mlx.py@dirty-proxy-eval-cap-qk_gain_init_1p75","train_loss":3.9006,"val_loss":4.06094033,"val_bpb":2.43602055,"train_time_ms":87095.0,"step_avg_ms":435.47,"tok_s":20909.0,"artifact_raw_bytes":67212188,"artifact_int8_bytes":11293354,"status":"maybe","reason":"Confirmation rerun failed to reproduce the earlier gain; the candidate remains ambiguous and should not be promoted as the base configuration yet."}
{"run_id":"mlx_smoke","phase":"proxy_screen_fast","parent_commit":"a48087dd91db1c2ea6e41f8bd0d0cd09320cbdb8","commit":"a3037b4d32ae19fae8b890d9afba9366f42309d0","change_type":"scalar_config","change_summary":"Raise MUON_MOMENTUM default from 0.95 to 0.97 for fast proxy screening","env":{"python":"python3","iterations":200,"train_batch_tokens":8192,"val_batch_size":8192,"val_loss_every":0,"muon_momentum":0.97,"proxy_val_batches":2048,"proxy_skip_quant_eval":1,"log_path":"logs/mlx_smoke.txt","sandbox":"approved_exact_command"},"code_fingerprint":"train_gpt_mlx.py@dirty-proxy-eval-cap-muon_momentum_0p97","train_loss":3.9083,"val_loss":4.07368956,"val_bpb":2.44366839,"train_time_ms":78583.0,"step_avg_ms":392.92,"tok_s":21689.0,"artifact_raw_bytes":67212188,"artifact_int8_bytes":11295550,"status":"discard","reason":"Fast proxy screen slightly regressed versus the fast proxy baseline and increased compressed artifact size."}
{"run_id":"mlx_smoke","phase":"proxy_screen_fast","parent_commit":"a3037b4d32ae19fae8b890d9afba9366f42309d0","commit":"79fd0bb11c8de4c282b2777553ca30f40e63aa80","change_type":"scalar_config","change_summary":"Lower SCALAR_LR default from 0.04 to 0.02 for fast proxy screening","env":{"python":"python3","iterations":200,"train_batch_tokens":8192,"val_batch_size":8192,"val_loss_every":0,"scalar_lr":0.02,"proxy_val_batches":2048,"proxy_skip_quant_eval":1,"log_path":"logs/mlx_smoke.txt","sandbox":"approved_exact_command"},"code_fingerprint":"train_gpt_mlx.py@dirty-proxy-eval-cap-scalar_lr_0p02","train_loss":3.8680,"val_loss":4.01105530,"val_bpb":2.40609621,"train_time_ms":76359.0,"step_avg_ms":381.79,"tok_s":21948.0,"artifact_raw_bytes":67212188,"artifact_int8_bytes":11505080,"status":"maybe","reason":"Fast proxy screen produced a strong val_bpb gain versus the fast proxy baseline, but it needs confirmation and has a worse compressed artifact size."}
{"run_id":"mlx_smoke","phase":"proxy_screen_fast_confirm","parent_commit":"79fd0bb11c8de4c282b2777553ca30f40e63aa80","commit":"2ee241a6c3a5c765b840e681dcda14af259df425","change_type":"scalar_config","change_summary":"Confirmation rerun for SCALAR_LR=0.02 under the fast proxy harness","env":{"python":"python3","iterations":200,"train_batch_tokens":8192,"val_batch_size":8192,"val_loss_every":0,"scalar_lr":0.02,"proxy_val_batches":2048,"proxy_skip_quant_eval":1,"log_path":"logs/mlx_smoke.txt","sandbox":"approved_exact_command"},"code_fingerprint":"train_gpt_mlx.py@dirty-proxy-eval-cap-scalar_lr_0p02","train_loss":3.8634,"val_loss":3.97802601,"val_bpb":2.38628306,"train_time_ms":103239.0,"step_avg_ms":516.19,"tok_s":15947.0,"artifact_raw_bytes":67212188,"artifact_int8_bytes":11330554,"status":"keep","reason":"Confirmation rerun reproduced and improved the fast proxy val_bpb gain, so SCALAR_LR=0.02 becomes the new working fast-proxy base despite a larger compressed artifact than the default fast baseline."}
{"run_id":"mlx_smoke","phase":"proxy_screen_fast","parent_commit":"2ee241a6c3a5c765b840e681dcda14af259df425","commit":"8f9d3247fc3162527d6ca58f732c1544ec8a4380","change_type":"scalar_config","change_summary":"Enable GRAD_CLIP_NORM=1.0 on top of the SCALAR_LR=0.02 fast proxy base","env":{"python":"python3","iterations":200,"train_batch_tokens":8192,"val_batch_size":8192,"val_loss_every":0,"scalar_lr":0.02,"grad_clip_norm":1.0,"proxy_val_batches":2048,"proxy_skip_quant_eval":1,"log_path":"logs/mlx_smoke.txt","sandbox":"approved_exact_command"},"code_fingerprint":"train_gpt_mlx.py@dirty-proxy-eval-cap-scalar_lr_0p02-grad_clip_1p0","train_loss":3.7964,"val_loss":3.95706904,"val_bpb":2.37371169,"train_time_ms":100477.0,"step_avg_ms":502.38,"tok_s":18958.0,"artifact_raw_bytes":67212188,"artifact_int8_bytes":11189754,"status":"maybe","reason":"Fast proxy screen improved both val_bpb and compressed artifact size versus the current SCALAR_LR=0.02 base, so it warrants confirmation."}
{"run_id":"mlx_smoke","phase":"proxy_screen_fast_confirm","parent_commit":"8f9d3247fc3162527d6ca58f732c1544ec8a4380","commit":"c7e28da9fe1bbf210c1b4b49ecf9d36158047358","change_type":"scalar_config","change_summary":"Confirmation rerun for GRAD_CLIP_NORM=1.0 on top of the SCALAR_LR=0.02 fast proxy base","env":{"python":"python3","iterations":200,"train_batch_tokens":8192,"val_batch_size":8192,"val_loss_every":0,"scalar_lr":0.02,"grad_clip_norm":1.0,"proxy_val_batches":2048,"proxy_skip_quant_eval":1,"log_path":"logs/mlx_smoke.txt","sandbox":"approved_exact_command"},"code_fingerprint":"train_gpt_mlx.py@dirty-proxy-eval-cap-scalar_lr_0p02-grad_clip_1p0","train_loss":3.8002,"val_loss":3.93299751,"val_bpb":2.35927199,"train_time_ms":111826.0,"step_avg_ms":559.13,"tok_s":14178.0,"artifact_raw_bytes":67212188,"artifact_int8_bytes":11100841,"status":"keep","reason":"Confirmation rerun reproduced and improved both val_bpb and compressed artifact size, so GRAD_CLIP_NORM=1.0 becomes part of the new fast-proxy working base on top of SCALAR_LR=0.02."}
{"run_id":"mlx_smoke","phase":"proxy_screen_fast","parent_commit":"c7e28da9fe1bbf210c1b4b49ecf9d36158047358","commit":"383428f52bded56429d041b415bd2cf1a462a3a3","change_type":"scalar_config","change_summary":"Lower LOGIT_SOFTCAP default from 30.0 to 20.0 on top of the confirmed SCALAR_LR=0.02 + GRAD_CLIP_NORM=1.0 fast proxy base","env":{"python":"python3","iterations":200,"train_batch_tokens":8192,"val_batch_size":8192,"val_loss_every":0,"scalar_lr":0.02,"grad_clip_norm":1.0,"logit_softcap":20.0,"proxy_val_batches":2048,"proxy_skip_quant_eval":1,"log_path":"logs/mlx_smoke.txt","sandbox":"approved_exact_command"},"code_fingerprint":"train_gpt_mlx.py@dirty-proxy-eval-cap-scalar_lr_0p02-grad_clip_1p0-logit_softcap_20","train_loss":3.7720,"val_loss":3.90130655,"val_bpb":2.34026166,"train_time_ms":123580.0,"step_avg_ms":617.90,"tok_s":13416.0,"artifact_raw_bytes":67212188,"artifact_int8_bytes":10900773,"status":"maybe","reason":"Fast proxy screen improved both val_bpb and compressed artifact size versus the confirmed SCALAR_LR=0.02 + GRAD_CLIP_NORM=1.0 base, so it warrants confirmation."}
{"run_id":"mlx_smoke","phase":"proxy_screen_fast_confirm","parent_commit":"383428f52bded56429d041b415bd2cf1a462a3a3","commit":"6ab3c0a783055d69c2a5efc640f949bb980dbd71","change_type":"scalar_config","change_summary":"Confirmation rerun for LOGIT_SOFTCAP=20.0 on top of the confirmed SCALAR_LR=0.02 + GRAD_CLIP_NORM=1.0 fast proxy base","env":{"python":"python3","iterations":200,"train_batch_tokens":8192,"val_batch_size":8192,"val_loss_every":0,"scalar_lr":0.02,"grad_clip_norm":1.0,"logit_softcap":20.0,"proxy_val_batches":2048,"proxy_skip_quant_eval":1,"log_path":"logs/mlx_smoke.txt","sandbox":"approved_exact_command"},"code_fingerprint":"train_gpt_mlx.py@dirty-proxy-eval-cap-scalar_lr_0p02-grad_clip_1p0-logit_softcap_20","train_loss":3.7777,"val_loss":3.89159226,"val_bpb":2.33443439,"train_time_ms":128949.0,"step_avg_ms":644.74,"tok_s":12621.0,"artifact_raw_bytes":67212188,"artifact_int8_bytes":10829872,"status":"keep","reason":"Confirmation rerun reproduced and improved both val_bpb and compressed artifact size, so LOGIT_SOFTCAP=20.0 becomes part of the new fast-proxy working base on top of SCALAR_LR=0.02 and GRAD_CLIP_NORM=1.0."}
{"run_id":"h100_tp_gradacc4_gc10_seed1337_r2","phase":"phase_1_confirmations","parent_commit":"h100_tp_gradacc4_gc10","commit":"208bbc14d25064bd7f03644bd997b76fd08123e3","change_type":"throughput_engineering","change_summary":"Grad accum 4 plus grad clip 1.0 clean rerun","env":{"GRAD_ACCUM_STEPS":"4","GRAD_CLIP_NORM":"1.0","SEED":"1337"},"code_fingerprint":"train_gpt.py@208bbc14+h100-confirmation","train_loss":null,"val_loss":2.1952353,"val_bpb":1.30014199,"train_time_ms":600257,"step_avg_ms":322.37,"tok_s":1626354.81,"artifact_raw_bytes":0,"artifact_int8_bytes":14785037,"status":"keep","reason":"Clean H100 confirmation of GRAD_ACCUM_STEPS=4 + GRAD_CLIP_NORM=1.0; promoted current 1xH100 best."}
{"run_id":"h100_muon_momentum_0975_seed1337_r2","phase":"phase_1_confirmations","parent_commit":"h100_muon_momentum_0975","commit":"208bbc14d25064bd7f03644bd997b76fd08123e3","change_type":"hparam_optimizer","change_summary":"Muon momentum 0.975 clean rerun","env":{"MUON_MOMENTUM":"0.975","SEED":"1337"},"code_fingerprint":"train_gpt.py@208bbc14+h100-confirmation","train_loss":null,"val_loss":2.22458755,"val_bpb":1.31752605,"train_time_ms":600146,"step_avg_ms":393.28,"tok_s":1333116.35,"artifact_raw_bytes":0,"artifact_int8_bytes":14857373,"status":"keep","reason":"Clean H100 confirmation of MUON_MOMENTUM=0.975; confirmed optimizer alternate behind the throughput recipe."}
{"run_id":"h100_tp_gradacc4_gc10_seed2024","phase":"phase_1_followup","parent_commit":"h100_tp_gradacc4_gc10_seed1337_r2","commit":"208bbc14d25064bd7f03644bd997b76fd08123e3","change_type":"throughput_engineering","change_summary":"Grad accum 4 plus grad clip 1.0 second-seed confirmation","env":{"GRAD_ACCUM_STEPS":"4","GRAD_CLIP_NORM":"1.0","SEED":"2024"},"code_fingerprint":"train_gpt.py@208bbc14+h100-followup","train_loss":null,"val_loss":2.20841046,"val_bpb":1.30794507,"train_time_ms":600266,"step_avg_ms":356.03,"tok_s":1472595.01,"artifact_raw_bytes":0,"artifact_int8_bytes":14455311,"status":"keep","reason":"Second-seed confirmation supports the promoted throughput recipe."}
{"run_id":"h100_tp_gradacc4_gc10_muon0975_seed1337","phase":"phase_1_followup","parent_commit":"h100_tp_gradacc4_gc10_seed1337_r2","commit":"208bbc14d25064bd7f03644bd997b76fd08123e3","change_type":"hparam_optimizer","change_summary":"Grad accum 4 plus grad clip 1.0 plus muon momentum 0.975","env":{"GRAD_ACCUM_STEPS":"4","GRAD_CLIP_NORM":"1.0","MUON_MOMENTUM":"0.975","SEED":"1337"},"code_fingerprint":"train_gpt.py@208bbc14+h100-followup","train_loss":null,"val_loss":2.19450906,"val_bpb":1.29971188,"train_time_ms":600173,"step_avg_ms":325.47,"tok_s":1610864.29,"artifact_raw_bytes":0,"artifact_int8_bytes":15513390,"status":"maybe","reason":"Raw bpb is a tiny new low, but improvement over current best is below the noise gate and artifact size is close to the 16MB cap."}
