{"batch": "phase_1_knobs_b", "bytes_model_int8_zlib": 13683972, "bytes_total_int8_zlib": 13732512, "category": "hparam_optimizer", "command": "SEED=1337 MUON_MOMENTUM=0.975 torchrun --standalone --nproc_per_node=1 train_gpt.py", "decision": "retest", "delta_vs_baseline": -0.00976229, "delta_vs_parent": -0.00976229, "description": "Muon momentum 0.975", "duration_seconds": 600.332, "env_overrides": {"MUON_MOMENTUM": "0.975", "SEED": "1337"}, "exit_code": 0, "final_eval_time_ms": 11083, "finished_at": "2026-04-22T09:01:00Z", "grad_accum_steps": 8, "iterations": 20000, "max_wallclock_seconds": 600.0, "model_params": 17059912, "notes": "improves beyond noise but not 2x noise threshold; rerun from clean state", "parent_recipe": "h100_baseline_sp1024", "path_log": "/workspace/parameter-golf/logs/h100_phase1b_lane1/h100_muon_momentum_0975.log", "peak_memory_allocated_mib": 10239, "peak_memory_reserved_mib": 10554, "priority": 1, "run_id": "h100_muon_momentum_0975", "seed": 1337, "started_at": "2026-04-22T08:49:32Z", "status": "maybe", "step": 1248, "step_avg_ms": 481.04, "telemetry": {"gpu_count": 1, "gpu_csv_path": "/workspace/parameter-golf/logs/h100_phase1b_lane1/h100_muon_momentum_0975.nvidia_smi.csv", "gpu_mem_total_mb": 81559.0, "gpu_mem_used_max_mb": 11871.0, "gpu_util_device_mean_max_pct": 65.71, "gpu_util_device_mean_min_pct": 65.71, "gpu_util_max_pct": 100.0, "gpu_util_mean_pct": 65.71, "memory_controller_util_max_pct": 77.0, "memory_controller_util_mean_pct": 48.17, "meta_json_path": "/workspace/parameter-golf/logs/h100_phase1b_lane1/h100_muon_momentum_0975.telemetry_meta.json", "power_max_w": 691.31, "power_mean_w": 483.6, "proc_snapshot_log": "/workspace/parameter-golf/logs/h100_phase1b_lane1/h100_muon_momentum_0975.proc_snapshots.log", "telemetry_samples": 66, "temperature_max_c": 55.0, "vram_used_device_mean_max_pct": 14.14, "vram_used_device_mean_min_pct": 14.14, "vram_used_max_pct": 14.56, "vram_used_mean_pct": 14.14}, "tok_s": 1089905.21, "tok_s_per_gpu": 1089905.21, "train_batch_tokens": 524288, "train_microbatch_tokens_per_gpu": 65536, "train_seq_len": 1024, "train_time_ms": 600332, "val_bpb": 1.33240794, "val_loss": 2.249715, "warmup_steps": 20, "world_size": 1}
{"batch": "phase_1_knobs_b", "bytes_model_int8_zlib": 12985616, "bytes_total_int8_zlib": 13034156, "category": "hparam_optimizer", "command": "SEED=1337 MUON_MOMENTUM_WARMUP_STEPS=1000 torchrun --standalone --nproc_per_node=1 train_gpt.py", "decision": "discard", "delta_vs_baseline": -0.00448379, "delta_vs_parent": -0.00448379, "description": "Muon momentum warmup steps 1000", "duration_seconds": 600.093, "env_overrides": {"MUON_MOMENTUM_WARMUP_STEPS": "1000", "SEED": "1337"}, "exit_code": 0, "final_eval_time_ms": 11100, "finished_at": "2026-04-22T09:12:09Z", "grad_accum_steps": 8, "iterations": 20000, "max_wallclock_seconds": 600.0, "model_params": 17059912, "notes": "improvement is smaller than estimated noise", "parent_recipe": "h100_baseline_sp1024", "path_log": "/workspace/parameter-golf/logs/h100_phase1b_lane1/h100_muon_warmup_1000.log", "peak_memory_allocated_mib": 10239, "peak_memory_reserved_mib": 10554, "priority": 1, "run_id": "h100_muon_warmup_1000", "seed": 1337, "started_at": "2026-04-22T09:01:01Z", "status": "discard", "step": 1336, "step_avg_ms": 449.17, "telemetry": {"gpu_count": 1, "gpu_csv_path": "/workspace/parameter-golf/logs/h100_phase1b_lane1/h100_muon_warmup_1000.nvidia_smi.csv", "gpu_mem_total_mb": 81559.0, "gpu_mem_used_max_mb": 11871.0, "gpu_util_device_mean_max_pct": 71.39, "gpu_util_device_mean_min_pct": 71.39, "gpu_util_max_pct": 100.0, "gpu_util_mean_pct": 71.39, "memory_controller_util_max_pct": 77.0, "memory_controller_util_mean_pct": 51.75, "meta_json_path": "/workspace/parameter-golf/logs/h100_phase1b_lane1/h100_muon_warmup_1000.telemetry_meta.json", "power_max_w": 693.48, "power_mean_w": 507.53, "proc_snapshot_log": "/workspace/parameter-golf/logs/h100_phase1b_lane1/h100_muon_warmup_1000.proc_snapshots.log", "telemetry_samples": 64, "temperature_max_c": 57.0, "vram_used_device_mean_max_pct": 14.12, "vram_used_device_mean_min_pct": 14.12, "vram_used_max_pct": 14.56, "vram_used_mean_pct": 14.12}, "tok_s": 1167237.35, "tok_s_per_gpu": 1167237.35, "train_batch_tokens": 524288, "train_microbatch_tokens_per_gpu": 65536, "train_seq_len": 1024, "train_time_ms": 600093, "val_bpb": 1.33768644, "val_loss": 2.25862751, "warmup_steps": 20, "world_size": 1}
{"batch": "phase_1_confirmations", "bytes_model_int8_zlib": 14736497, "bytes_total_int8_zlib": 14785037, "category": "throughput_engineering", "command": "SEED=1337 GRAD_CLIP_NORM=1.0 GRAD_ACCUM_STEPS=4 torchrun --standalone --nproc_per_node=1 train_gpt.py", "decision": "promote", "delta_vs_baseline": null, "delta_vs_parent": null, "description": "Grad accum 4 plus grad clip 1.0 clean rerun", "duration_seconds": 600.257, "env_overrides": {"GRAD_ACCUM_STEPS": "4", "GRAD_CLIP_NORM": "1.0", "SEED": "1337"}, "exit_code": 0, "final_eval_time_ms": 10753, "finished_at": "2026-04-25T01:19:26Z", "grad_accum_steps": 4, "iterations": 20000, "max_wallclock_seconds": 600.0, "model_params": 17059912, "notes": "Clean confirmation improved the promoted throughput recipe; keep as current 1xH100 loss and speed leader.", "parent_recipe": "h100_tp_gradacc4_gc10", "path_log": "/Users/sanilbaweja/Projects/parameter-golf/logs/h100_campaign_20260421/h100_tp_gradacc4_gc10_seed1337_r2.log", "peak_memory_allocated_mib": 20115, "peak_memory_reserved_mib": 20854, "priority": 1, "run_id": "h100_tp_gradacc4_gc10_seed1337_r2", "seed": 1337, "started_at": "2026-04-25T01:07:35Z", "status": "keep", "step": 1862, "step_avg_ms": 322.37, "telemetry": {"gpu_count": 1, "gpu_csv_path": "/Users/sanilbaweja/Projects/parameter-golf/logs/h100_campaign_20260421/h100_tp_gradacc4_gc10_seed1337_r2.nvidia_smi.csv", "gpu_mem_total_mb": 81559.0, "gpu_mem_used_max_mb": 22173.0, "gpu_util_device_mean_max_pct": 85.01, "gpu_util_device_mean_min_pct": 85.01, "gpu_util_max_pct": 100.0, "gpu_util_mean_pct": 85.01, "memory_controller_util_max_pct": 80.0, "memory_controller_util_mean_pct": 63.7, "meta_json_path": "/Users/sanilbaweja/Projects/parameter-golf/logs/h100_campaign_20260421/h100_tp_gradacc4_gc10_seed1337_r2.telemetry_meta.json", "power_max_w": 693.54, "power_mean_w": 605.16, "proc_snapshot_log": "/Users/sanilbaweja/Projects/parameter-golf/logs/h100_campaign_20260421/h100_tp_gradacc4_gc10_seed1337_r2.proc_snapshots.log", "telemetry_samples": 70, "temperature_max_c": 60.0, "vram_used_device_mean_max_pct": 26.02, "vram_used_device_mean_min_pct": 26.02, "vram_used_max_pct": 27.19, "vram_used_mean_pct": 26.02}, "tok_s": 1626354.81, "tok_s_per_gpu": 1626354.81, "train_batch_tokens": 524288, "train_microbatch_tokens_per_gpu": 131072, "train_seq_len": 1024, "train_time_ms": 600257, "val_bpb": 1.30014199, "val_loss": 2.1952353, "warmup_steps": 20, "world_size": 1}
{"batch": "phase_1_confirmations", "bytes_model_int8_zlib": 14808833, "bytes_total_int8_zlib": 14857373, "category": "hparam_optimizer", "command": "SEED=1337 MUON_MOMENTUM=0.975 torchrun --standalone --nproc_per_node=1 train_gpt.py", "decision": "keep_alt", "delta_vs_baseline": null, "delta_vs_parent": null, "description": "Muon momentum 0.975 clean rerun", "duration_seconds": 600.146, "env_overrides": {"MUON_MOMENTUM": "0.975", "SEED": "1337"}, "exit_code": 0, "final_eval_time_ms": 11113, "finished_at": "2026-04-25T01:19:26Z", "grad_accum_steps": 8, "iterations": 20000, "max_wallclock_seconds": 600.0, "model_params": 17059912, "notes": "Clean confirmation improved over the prior maybe run; keep as optimizer alternate but not ahead of gradacc throughput recipe.", "parent_recipe": "h100_muon_momentum_0975", "path_log": "/Users/sanilbaweja/Projects/parameter-golf/logs/h100_campaign_20260421/h100_muon_momentum_0975_seed1337_r2.log", "peak_memory_allocated_mib": 10239, "peak_memory_reserved_mib": 10730, "priority": 1, "run_id": "h100_muon_momentum_0975_seed1337_r2", "seed": 1337, "started_at": "2026-04-25T01:07:35Z", "status": "keep", "step": 1526, "step_avg_ms": 393.28, "telemetry": {"gpu_count": 1, "gpu_csv_path": "/Users/sanilbaweja/Projects/parameter-golf/logs/h100_campaign_20260421/h100_muon_momentum_0975_seed1337_r2.nvidia_smi.csv", "gpu_mem_total_mb": 81559.0, "gpu_mem_used_max_mb": 12049.0, "gpu_util_device_mean_max_pct": 77.41, "gpu_util_device_mean_min_pct": 77.41, "gpu_util_max_pct": 100.0, "gpu_util_mean_pct": 77.41, "memory_controller_util_max_pct": 80.0, "memory_controller_util_mean_pct": 56.57, "meta_json_path": "/Users/sanilbaweja/Projects/parameter-golf/logs/h100_campaign_20260421/h100_muon_momentum_0975_seed1337_r2.telemetry_meta.json", "power_max_w": 692.49, "power_mean_w": 544.42, "proc_snapshot_log": "/Users/sanilbaweja/Projects/parameter-golf/logs/h100_campaign_20260421/h100_muon_momentum_0975_seed1337_r2.proc_snapshots.log", "telemetry_samples": 69, "temperature_max_c": 57.0, "vram_used_device_mean_max_pct": 14.15, "vram_used_device_mean_min_pct": 14.15, "vram_used_max_pct": 14.77, "vram_used_mean_pct": 14.15}, "tok_s": 1333116.35, "tok_s_per_gpu": 1333116.35, "train_batch_tokens": 524288, "train_microbatch_tokens_per_gpu": 65536, "train_seq_len": 1024, "train_time_ms": 600146, "val_bpb": 1.31752605, "val_loss": 2.22458755, "warmup_steps": 20, "world_size": 1}
{"batch": "phase_1_followup", "bytes_model_int8_zlib": 14406771, "bytes_total_int8_zlib": 14455311, "category": "throughput_engineering", "command": "SEED=2024 GRAD_CLIP_NORM=1.0 GRAD_ACCUM_STEPS=4 torchrun --standalone --nproc_per_node=1 train_gpt.py", "decision": "confirm", "delta_vs_baseline": null, "delta_vs_parent": null, "description": "Grad accum 4 plus grad clip 1.0 second-seed confirmation", "duration_seconds": 600.266, "env_overrides": {"GRAD_ACCUM_STEPS": "4", "GRAD_CLIP_NORM": "1.0", "SEED": "2024"}, "exit_code": 0, "final_eval_time_ms": 11701, "finished_at": "2026-04-25T05:35:02Z", "grad_accum_steps": 4, "iterations": 20000, "max_wallclock_seconds": 600.0, "model_params": 17059912, "notes": "Second-seed confirmation supports the promoted throughput recipe.", "parent_recipe": "h100_tp_gradacc4_gc10_seed1337_r2", "path_log": "/Users/sanilbaweja/Projects/parameter-golf/logs/h100_campaign_20260421/h100_tp_gradacc4_gc10_seed2024.log", "peak_memory_allocated_mib": 20115, "peak_memory_reserved_mib": 20854, "priority": 1, "run_id": "h100_tp_gradacc4_gc10_seed2024", "seed": 2024, "started_at": "2026-04-25T05:23:08Z", "status": "keep", "step": 1686, "step_avg_ms": 356.03, "telemetry": {"gpu_count": 1, "gpu_csv_path": "/Users/sanilbaweja/Projects/parameter-golf/logs/h100_campaign_20260421/h100_tp_gradacc4_gc10_seed2024.nvidia_smi.csv", "gpu_mem_total_mb": 81559.0, "gpu_mem_used_max_mb": 22173.0, "gpu_util_device_mean_max_pct": 85.94, "gpu_util_device_mean_min_pct": 85.94, "gpu_util_max_pct": 100.0, "gpu_util_mean_pct": 85.94, "memory_controller_util_max_pct": 85.0, "memory_controller_util_mean_pct": 59.01, "meta_json_path": "/Users/sanilbaweja/Projects/parameter-golf/logs/h100_campaign_20260421/h100_tp_gradacc4_gc10_seed2024.telemetry_meta.json", "power_max_w": 549.16, "power_mean_w": 457.21, "proc_snapshot_log": "/Users/sanilbaweja/Projects/parameter-golf/logs/h100_campaign_20260421/h100_tp_gradacc4_gc10_seed2024.proc_snapshots.log", "telemetry_samples": 70, "temperature_max_c": 47.0, "vram_used_device_mean_max_pct": 26.02, "vram_used_device_mean_min_pct": 26.02, "vram_used_max_pct": 27.19, "vram_used_mean_pct": 26.02}, "tok_s": 1472595.01, "tok_s_per_gpu": 1472595.01, "train_batch_tokens": 524288, "train_microbatch_tokens_per_gpu": 131072, "train_seq_len": 1024, "train_time_ms": 600266, "val_bpb": 1.30794507, "val_loss": 2.20841046, "warmup_steps": 20, "world_size": 1}
{"batch": "phase_1_followup", "bytes_model_int8_zlib": 15464850, "bytes_total_int8_zlib": 15513390, "category": "hparam_optimizer", "command": "SEED=1337 GRAD_CLIP_NORM=1.0 GRAD_ACCUM_STEPS=4 MUON_MOMENTUM=0.975 torchrun --standalone --nproc_per_node=1 train_gpt.py", "decision": "hold", "delta_vs_baseline": null, "delta_vs_parent": null, "description": "Grad accum 4 plus grad clip 1.0 plus muon momentum 0.975", "duration_seconds": 600.173, "env_overrides": {"GRAD_ACCUM_STEPS": "4", "GRAD_CLIP_NORM": "1.0", "MUON_MOMENTUM": "0.975", "SEED": "1337"}, "exit_code": 0, "final_eval_time_ms": 10786, "finished_at": "2026-04-25T05:34:59Z", "grad_accum_steps": 4, "iterations": 20000, "max_wallclock_seconds": 600.0, "model_params": 17059912, "notes": "Raw bpb is a tiny new low, but improvement over current best is below the noise gate and artifact size is close to the 16MB cap.", "parent_recipe": "h100_tp_gradacc4_gc10_seed1337_r2", "path_log": "/Users/sanilbaweja/Projects/parameter-golf/logs/h100_campaign_20260421/h100_tp_gradacc4_gc10_muon0975_seed1337.log", "peak_memory_allocated_mib": 20115, "peak_memory_reserved_mib": 20854, "priority": 1, "run_id": "h100_tp_gradacc4_gc10_muon0975_seed1337", "seed": 1337, "started_at": "2026-04-25T05:23:08Z", "status": "maybe", "step": 1844, "step_avg_ms": 325.47, "telemetry": {"gpu_count": 1, "gpu_csv_path": "/Users/sanilbaweja/Projects/parameter-golf/logs/h100_campaign_20260421/h100_tp_gradacc4_gc10_muon0975_seed1337.nvidia_smi.csv", "gpu_mem_total_mb": 81559.0, "gpu_mem_used_max_mb": 22173.0, "gpu_util_device_mean_max_pct": 85.41, "gpu_util_device_mean_min_pct": 85.41, "gpu_util_max_pct": 100.0, "gpu_util_mean_pct": 85.41, "memory_controller_util_max_pct": 80.0, "memory_controller_util_mean_pct": 64.09, "meta_json_path": "/Users/sanilbaweja/Projects/parameter-golf/logs/h100_campaign_20260421/h100_tp_gradacc4_gc10_muon0975_seed1337.telemetry_meta.json", "power_max_w": 694.26, "power_mean_w": 611.88, "proc_snapshot_log": "/Users/sanilbaweja/Projects/parameter-golf/logs/h100_campaign_20260421/h100_tp_gradacc4_gc10_muon0975_seed1337.proc_snapshots.log", "telemetry_samples": 70, "temperature_max_c": 62.0, "vram_used_device_mean_max_pct": 25.63, "vram_used_device_mean_min_pct": 25.63, "vram_used_max_pct": 27.19, "vram_used_mean_pct": 25.63}, "tok_s": 1610864.29, "tok_s_per_gpu": 1610864.29, "train_batch_tokens": 524288, "train_microbatch_tokens_per_gpu": 131072, "train_seq_len": 1024, "train_time_ms": 600173, "val_bpb": 1.29971188, "val_loss": 2.19450906, "warmup_steps": 20, "world_size": 1}
