{"batch": "batch_00_ingest", "bytes_model_int8_zlib": 12983083, "bytes_total_int8_zlib": 13031340, "category": "confirmation", "command": "torchrun --standalone --nproc_per_node=1 train_gpt.py", "decision": "keep", "delta_vs_baseline": 0.0, "delta_vs_parent": 0.0, "description": "Published train_gpt.py baseline on 1xH100", "duration_seconds": 600.182, "env_overrides": {}, "exit_code": 0, "finished_at": "", "iterations": 20000, "model_params": 17059912, "notes": "Baseline anchor from existing 1xH100 run bundle.", "parent_recipe": "baseline_anchor", "path_log": "logs/runpod_first_h100/h100_baseline_sp1024.log", "priority": 0, "run_id": "h100_baseline_sp1024", "seed": 1337, "started_at": "", "status": "keep", "step": 1193, "step_avg_ms": 503.09, "train_time_ms": 600182, "val_bpb": 1.34217023, "val_loss": 2.26619822}
{"batch": "batch_00_ingest", "bytes_model_int8_zlib": 13101250, "bytes_total_int8_zlib": 13149507, "category": "architecture_variant", "command": "MLP_ACT=silu torchrun --standalone --nproc_per_node=1 train_gpt.py", "decision": "discard", "delta_vs_baseline": 0.00979971, "delta_vs_parent": 0.00979971, "description": "Activation swap only: MLP_ACT=silu", "duration_seconds": 600.141, "env_overrides": {"MLP_ACT": "silu"}, "exit_code": 0, "finished_at": "", "iterations": 20000, "model_params": 17059912, "notes": "Worse than baseline on 1xH100.", "parent_recipe": "h100_baseline_sp1024", "path_log": "logs/runpod_first_h100/h100_silu_sp1024.log", "priority": 1, "run_id": "h100_silu_sp1024", "seed": 1337, "started_at": "", "status": "discard", "step": 1187, "step_avg_ms": 505.59, "train_time_ms": 600141, "val_bpb": 1.35196994, "val_loss": 2.28274462}
{"batch": "batch_00_ingest", "bytes_model_int8_zlib": 13152676, "bytes_total_int8_zlib": 13200933, "category": "hparam_optimizer", "command": "MLP_ACT=silu TIED_EMBED_LR=0.04 torchrun --standalone --nproc_per_node=1 train_gpt.py", "decision": "retest", "delta_vs_baseline": -0.00082182, "delta_vs_parent": -0.00082182, "description": "Best local recipe so far: MLP_ACT=silu + TIED_EMBED_LR=0.04", "duration_seconds": 600.37, "env_overrides": {"MLP_ACT": "silu", "TIED_EMBED_LR": "0.04"}, "exit_code": 0, "finished_at": "", "iterations": 20000, "model_params": 17059912, "notes": "Tiny maybe-win versus baseline; requires confirmation before promotion.", "parent_recipe": "h100_baseline_sp1024", "path_log": "logs/runpod_first_h100/h100_silu_embed004_sp1024.log", "priority": 1, "run_id": "h100_silu_embed004_sp1024", "seed": 1337, "started_at": "", "status": "maybe", "step": 1227, "step_avg_ms": 489.3, "train_time_ms": 600370, "val_bpb": 1.34134841, "val_loss": 2.2648106}
{"batch": "batch_00_ingest", "bytes_model_int8_zlib": 7750740, "bytes_total_int8_zlib": 7798997, "category": "architecture_compact", "command": "MLP_ACT=silu TIED_EMBED_LR=0.04 MODEL_DIM=384 NUM_HEADS=8 NUM_KV_HEADS=4 torchrun --standalone --nproc_per_node=1 train_gpt.py", "decision": "hold", "delta_vs_baseline": 0.04203998, "delta_vs_parent": 0.0428618, "description": "Compact architecture candidate: silu + tied_embed_lr=0.04 + dim384", "duration_seconds": 600.468, "env_overrides": {"MLP_ACT": "silu", "MODEL_DIM": "384", "NUM_HEADS": "8", "NUM_KV_HEADS": "4", "TIED_EMBED_LR": "0.04"}, "exit_code": 0, "finished_at": "", "iterations": 20000, "model_params": 9698376, "notes": "Strong compact-size candidate, not a raw val_bpb leader.", "parent_recipe": "h100_silu_embed004_sp1024", "path_log": "logs/runpod_first_h100/h100_silu_embed004_dim384_sp1024.log", "priority": 1, "run_id": "h100_silu_embed004_dim384_sp1024", "seed": 1337, "started_at": "", "status": "keep", "step": 1252, "step_avg_ms": 479.61, "train_time_ms": 600468, "val_bpb": 1.38421021, "val_loss": 2.33718096}
{"batch": "phase_0_noise_estimation", "bytes_model_int8_zlib": 12942995, "bytes_total_int8_zlib": 12991252, "category": "confirmation", "command": "SEED=1337 torchrun --standalone --nproc_per_node=1 train_gpt.py", "decision": "keep", "delta_vs_baseline": null, "delta_vs_parent": null, "description": "Baseline rerun with same seed for noise estimation", "duration_seconds": 600.327, "env_overrides": {"SEED": "1337"}, "exit_code": 0, "finished_at": "2026-04-22T05:38:51Z", "iterations": 20000, "model_params": 17059912, "notes": "", "parent_recipe": "h100_baseline_sp1024", "path_log": "/workspace/parameter-golf/logs/h100_campaign_20260421/h100_baseline_sp1024_seed1337_r2.log", "priority": 1, "run_id": "h100_baseline_sp1024_seed1337_r2", "seed": 1337, "started_at": "2026-04-22T05:26:54Z", "status": "ok", "step": 1176, "step_avg_ms": 510.48, "train_time_ms": 600327, "val_bpb": 1.34352379, "val_loss": 2.26848364}
{"batch": "phase_0_noise_estimation", "bytes_model_int8_zlib": 13085018, "bytes_total_int8_zlib": 13133275, "category": "confirmation", "command": "SEED=2024 torchrun --standalone --nproc_per_node=1 train_gpt.py", "decision": "keep", "delta_vs_baseline": null, "delta_vs_parent": null, "description": "Baseline run with second seed for noise estimation", "duration_seconds": 600.379, "env_overrides": {"SEED": "2024"}, "exit_code": 0, "finished_at": "2026-04-22T05:52:46Z", "iterations": 20000, "model_params": 17059912, "notes": "", "parent_recipe": "h100_baseline_sp1024", "path_log": "/workspace/parameter-golf/logs/h100_campaign_20260421/h100_baseline_sp1024_seed2024.log", "priority": 1, "run_id": "h100_baseline_sp1024_seed2024", "seed": 2024, "started_at": "2026-04-22T05:41:38Z", "status": "ok", "step": 1214, "step_avg_ms": 494.55, "train_time_ms": 600379, "val_bpb": 1.33799936, "val_loss": 2.25915588}
{"batch": "phase_1_knobs_a", "bytes_model_int8_zlib": 13243604, "bytes_total_int8_zlib": 13291861, "category": "hparam_optimizer", "command": "SEED=1337 QK_GAIN_INIT=1.25 torchrun --standalone --nproc_per_node=1 train_gpt.py", "decision": "pending", "delta_vs_baseline": null, "delta_vs_parent": null, "description": "QK gain 1.25", "duration_seconds": 600.524, "env_overrides": {"QK_GAIN_INIT": "1.25", "SEED": "1337"}, "exit_code": 0, "finished_at": "2026-04-22T06:23:21Z", "iterations": 20000, "model_params": 17059912, "notes": "", "parent_recipe": "h100_baseline_sp1024", "path_log": "/workspace/parameter-golf/logs/h100_campaign_20260421/h100_qk_gain_125.log", "priority": 1, "run_id": "h100_qk_gain_125", "seed": 1337, "started_at": "2026-04-22T06:11:27Z", "status": "ok", "step": 1229, "step_avg_ms": 488.63, "telemetry": {"gpu_csv_path": "/workspace/parameter-golf/logs/h100_campaign_20260421/h100_qk_gain_125.nvidia_smi.csv", "gpu_mem_mean_pct": 44.62, "gpu_mem_used_max_mb": 12575.0, "gpu_util_max_pct": 100.0, "gpu_util_mean_pct": 61.79, "meta_json_path": "/workspace/parameter-golf/logs/h100_campaign_20260421/h100_qk_gain_125.telemetry_meta.json", "power_mean_w": 457.07, "proc_snapshot_log": "/workspace/parameter-golf/logs/h100_campaign_20260421/h100_qk_gain_125.proc_snapshots.log", "telemetry_samples": 68, "temperature_max_c": 55.0}, "train_time_ms": 600524, "val_bpb": 1.34302087, "val_loss": 2.26763448}
{"batch": "phase_1_knobs_a", "bytes_model_int8_zlib": 13185944, "bytes_total_int8_zlib": 13234201, "category": "hparam_optimizer", "command": "SEED=1337 QK_GAIN_INIT=1.75 torchrun --standalone --nproc_per_node=1 train_gpt.py", "decision": "pending", "delta_vs_baseline": null, "delta_vs_parent": null, "description": "QK gain 1.75", "duration_seconds": 600.424, "env_overrides": {"QK_GAIN_INIT": "1.75", "SEED": "1337"}, "exit_code": 0, "finished_at": "2026-04-22T06:34:29Z", "iterations": 20000, "model_params": 17059912, "notes": "", "parent_recipe": "h100_baseline_sp1024", "path_log": "/workspace/parameter-golf/logs/h100_campaign_20260421/h100_qk_gain_175.log", "priority": 1, "run_id": "h100_qk_gain_175", "seed": 1337, "started_at": "2026-04-22T06:23:22Z", "status": "ok", "step": 1232, "step_avg_ms": 487.36, "telemetry": {"gpu_csv_path": "/workspace/parameter-golf/logs/h100_campaign_20260421/h100_qk_gain_175.nvidia_smi.csv", "gpu_mem_mean_pct": 49.48, "gpu_mem_used_max_mb": 11871.0, "gpu_util_max_pct": 100.0, "gpu_util_mean_pct": 68.85, "meta_json_path": "/workspace/parameter-golf/logs/h100_campaign_20260421/h100_qk_gain_175.telemetry_meta.json", "power_mean_w": 475.05, "proc_snapshot_log": "/workspace/parameter-golf/logs/h100_campaign_20260421/h100_qk_gain_175.proc_snapshots.log", "telemetry_samples": 62, "temperature_max_c": 53.0}, "train_time_ms": 600424, "val_bpb": 1.34099903, "val_loss": 2.26422068}
{"batch": "phase_1_knobs_a", "bytes_model_int8_zlib": 13040015, "bytes_total_int8_zlib": 13088272, "category": "hparam_optimizer", "command": "SEED=1337 SCALAR_LR=0.03 torchrun --standalone --nproc_per_node=1 train_gpt.py", "decision": "pending", "delta_vs_baseline": null, "delta_vs_parent": null, "description": "Scalar LR 0.03", "duration_seconds": 600.276, "env_overrides": {"SCALAR_LR": "0.03", "SEED": "1337"}, "exit_code": 0, "finished_at": "2026-04-22T06:45:42Z", "iterations": 20000, "model_params": 17059912, "notes": "", "parent_recipe": "h100_baseline_sp1024", "path_log": "/workspace/parameter-golf/logs/h100_campaign_20260421/h100_scalar_lr_003.log", "priority": 1, "run_id": "h100_scalar_lr_003", "seed": 1337, "started_at": "2026-04-22T06:34:31Z", "status": "ok", "step": 1209, "step_avg_ms": 496.51, "telemetry": {"gpu_csv_path": "/workspace/parameter-golf/logs/h100_campaign_20260421/h100_scalar_lr_003.nvidia_smi.csv", "gpu_mem_mean_pct": 44.48, "gpu_mem_used_max_mb": 11871.0, "gpu_util_max_pct": 100.0, "gpu_util_mean_pct": 60.97, "meta_json_path": "/workspace/parameter-golf/logs/h100_campaign_20260421/h100_scalar_lr_003.telemetry_meta.json", "power_mean_w": 463.01, "proc_snapshot_log": "/workspace/parameter-golf/logs/h100_campaign_20260421/h100_scalar_lr_003.proc_snapshots.log", "telemetry_samples": 64, "temperature_max_c": 53.0}, "train_time_ms": 600276, "val_bpb": 1.33509342, "val_loss": 2.25424931}
{"batch": "phase_1_knobs_a", "bytes_model_int8_zlib": 13105512, "bytes_total_int8_zlib": 13153769, "category": "hparam_optimizer", "command": "SEED=1337 GRAD_CLIP_NORM=1.0 torchrun --standalone --nproc_per_node=1 train_gpt.py", "decision": "pending", "delta_vs_baseline": null, "delta_vs_parent": null, "description": "Grad clip 1.0", "duration_seconds": 600.146, "env_overrides": {"GRAD_CLIP_NORM": "1.0", "SEED": "1337"}, "exit_code": 0, "finished_at": "2026-04-22T06:56:51Z", "iterations": 20000, "model_params": 17059912, "notes": "", "parent_recipe": "h100_baseline_sp1024", "path_log": "/workspace/parameter-golf/logs/h100_campaign_20260421/h100_grad_clip_10.log", "priority": 1, "run_id": "h100_grad_clip_10", "seed": 1337, "started_at": "2026-04-22T06:45:43Z", "status": "ok", "step": 1300, "step_avg_ms": 461.65, "telemetry": {"gpu_csv_path": "/workspace/parameter-golf/logs/h100_campaign_20260421/h100_grad_clip_10.nvidia_smi.csv", "gpu_mem_mean_pct": 50.45, "gpu_mem_used_max_mb": 11871.0, "gpu_util_max_pct": 100.0, "gpu_util_mean_pct": 69.03, "meta_json_path": "/workspace/parameter-golf/logs/h100_campaign_20260421/h100_grad_clip_10.telemetry_meta.json", "power_mean_w": 491.06, "proc_snapshot_log": "/workspace/parameter-golf/logs/h100_campaign_20260421/h100_grad_clip_10.proc_snapshots.log", "telemetry_samples": 64, "temperature_max_c": 56.0}, "train_time_ms": 600146, "val_bpb": 1.33056815, "val_loss": 2.24660858}
{"batch": "phase_2_throughput_parallel", "bytes_model_int8_zlib": 12632646, "bytes_total_int8_zlib": 12681186, "category": "throughput_engineering", "command": "SEED=1337 GRAD_CLIP_NORM=1.0 TRAIN_BATCH_TOKENS=786432 torchrun --standalone --nproc_per_node=1 train_gpt.py", "decision": "hold", "delta_vs_baseline": null, "delta_vs_parent": null, "description": "Train batch tokens 786432 with grad clip 1.0", "duration_seconds": 600.362, "env_overrides": {"GRAD_CLIP_NORM": "1.0", "SEED": "1337", "TRAIN_BATCH_TOKENS": "786432"}, "exit_code": 0, "finished_at": "2026-04-22T07:47:27Z", "iterations": 20000, "model_params": 17059912, "notes": " Parallel throughput sweep result.", "parent_recipe": "h100_grad_clip_10", "path_log": "/workspace/parameter-golf/logs/h100_parallel_trials/h100_tp_batch786k_gc10/h100_tp_batch786k_gc10.log", "priority": 1, "run_id": "h100_tp_batch786k_gc10", "seed": 1337, "started_at": "2026-04-22T07:35:23Z", "status": "ok", "step": 1104, "step_avg_ms": 543.81, "telemetry": {"gpu_csv_path": "/workspace/parameter-golf/logs/h100_parallel_trials/h100_tp_batch786k_gc10/h100_tp_batch786k_gc10.nvidia_smi.csv", "gpu_mem_mean_pct": 58.41, "gpu_mem_used_max_mb": 16531.0, "gpu_util_max_pct": 100.0, "gpu_util_mean_pct": 78.12, "meta_json_path": "/workspace/parameter-golf/logs/h100_parallel_trials/h100_tp_batch786k_gc10/h100_tp_batch786k_gc10.telemetry_meta.json", "power_mean_w": 557.21, "proc_snapshot_log": "/workspace/parameter-golf/logs/h100_parallel_trials/h100_tp_batch786k_gc10/h100_tp_batch786k_gc10.proc_snapshots.log", "telemetry_samples": 69, "temperature_max_c": 59.0}, "train_time_ms": 600362, "val_bpb": 1.3256561, "val_loss": 2.2383148}
{"batch": "phase_2_throughput_parallel", "bytes_model_int8_zlib": 11916812, "bytes_total_int8_zlib": 11965352, "category": "throughput_engineering", "command": "SEED=1337 GRAD_CLIP_NORM=1.0 TRAIN_BATCH_TOKENS=1048576 torchrun --standalone --nproc_per_node=1 train_gpt.py", "decision": "hold", "delta_vs_baseline": null, "delta_vs_parent": null, "description": "Train batch tokens 1048576 with grad clip 1.0", "duration_seconds": 600.579, "env_overrides": {"GRAD_CLIP_NORM": "1.0", "SEED": "1337", "TRAIN_BATCH_TOKENS": "1048576"}, "exit_code": 0, "finished_at": "2026-04-22T07:47:45Z", "iterations": 20000, "model_params": 17059912, "notes": " Parallel throughput sweep result.", "parent_recipe": "h100_grad_clip_10", "path_log": "/workspace/parameter-golf/logs/h100_parallel_trials/h100_tp_batch1024k_gc10/h100_tp_batch1024k_gc10.log", "priority": 1, "run_id": "h100_tp_batch1024k_gc10", "seed": 1337, "started_at": "2026-04-22T07:35:23Z", "status": "ok", "step": 894, "step_avg_ms": 671.79, "telemetry": {"gpu_csv_path": "/workspace/parameter-golf/logs/h100_parallel_trials/h100_tp_batch1024k_gc10/h100_tp_batch1024k_gc10.nvidia_smi.csv", "gpu_mem_mean_pct": 62.01, "gpu_mem_used_max_mb": 22173.0, "gpu_util_max_pct": 100.0, "gpu_util_mean_pct": 82.59, "meta_json_path": "/workspace/parameter-golf/logs/h100_parallel_trials/h100_tp_batch1024k_gc10/h100_tp_batch1024k_gc10.telemetry_meta.json", "power_mean_w": 587.16, "proc_snapshot_log": "/workspace/parameter-golf/logs/h100_parallel_trials/h100_tp_batch1024k_gc10/h100_tp_batch1024k_gc10.proc_snapshots.log", "telemetry_samples": 70, "temperature_max_c": 60.0}, "train_time_ms": 600579, "val_bpb": 1.33894782, "val_loss": 2.2607573}
{"batch": "phase_2_throughput_parallel", "bytes_model_int8_zlib": 14362892, "bytes_total_int8_zlib": 14411432, "category": "throughput_engineering", "command": "SEED=1337 GRAD_CLIP_NORM=1.0 GRAD_ACCUM_STEPS=4 torchrun --standalone --nproc_per_node=1 train_gpt.py", "decision": "promote", "delta_vs_baseline": null, "delta_vs_parent": null, "description": "Grad accum steps 4 with grad clip 1.0", "duration_seconds": 600.147, "env_overrides": {"GRAD_ACCUM_STEPS": "4", "GRAD_CLIP_NORM": "1.0", "SEED": "1337"}, "exit_code": 0, "finished_at": "2026-04-22T07:47:39Z", "iterations": 20000, "model_params": 17059912, "notes": " Parallel throughput sweep result.", "parent_recipe": "h100_grad_clip_10", "path_log": "/workspace/parameter-golf/logs/h100_parallel_trials/h100_tp_gradacc4_gc10/h100_tp_gradacc4_gc10.log", "priority": 1, "run_id": "h100_tp_gradacc4_gc10", "seed": 1337, "started_at": "2026-04-22T07:35:23Z", "status": "ok", "step": 1685, "step_avg_ms": 356.17, "telemetry": {"gpu_csv_path": "/workspace/parameter-golf/logs/h100_parallel_trials/h100_tp_gradacc4_gc10/h100_tp_gradacc4_gc10.nvidia_smi.csv", "gpu_mem_mean_pct": 54.64, "gpu_mem_used_max_mb": 22173.0, "gpu_util_max_pct": 100.0, "gpu_util_mean_pct": 81.23, "meta_json_path": "/workspace/parameter-golf/logs/h100_parallel_trials/h100_tp_gradacc4_gc10/h100_tp_gradacc4_gc10.telemetry_meta.json", "power_mean_w": 457.41, "proc_snapshot_log": "/workspace/parameter-golf/logs/h100_parallel_trials/h100_tp_gradacc4_gc10/h100_tp_gradacc4_gc10.proc_snapshots.log", "telemetry_samples": 70, "temperature_max_c": 49.0}, "train_time_ms": 600147, "val_bpb": 1.30813214, "val_loss": 2.20872633}
{"batch": "phase_1_knobs_b", "bytes_model_int8_zlib": 12993988, "bytes_total_int8_zlib": 13042528, "category": "hparam_schedule", "command": "SEED=1337 LOGIT_SOFTCAP=20 torchrun --standalone --nproc_per_node=1 train_gpt.py", "decision": "discard", "delta_vs_baseline": 0.00498341, "delta_vs_parent": 0.00498341, "description": "Logit softcap 20", "duration_seconds": 600.239, "env_overrides": {"LOGIT_SOFTCAP": "20", "SEED": "1337"}, "exit_code": 0, "final_eval_time_ms": 12235, "finished_at": "2026-04-22T09:01:22Z", "grad_accum_steps": 8, "iterations": 20000, "max_wallclock_seconds": 600.0, "model_params": 17059912, "notes": "regresses vs baseline", "parent_recipe": "h100_baseline_sp1024", "path_log": "/workspace/parameter-golf/logs/h100_phase1b_lane2/h100_logit_softcap_20.log", "peak_memory_allocated_mib": 10239, "peak_memory_reserved_mib": 10554, "priority": 1, "run_id": "h100_logit_softcap_20", "seed": 1337, "started_at": "2026-04-22T08:49:32Z", "status": "discard", "step": 1200, "step_avg_ms": 500.2, "telemetry": {"gpu_count": 1, "gpu_csv_path": "/workspace/parameter-golf/logs/h100_phase1b_lane2/h100_logit_softcap_20.nvidia_smi.csv", "gpu_mem_total_mb": 81559.0, "gpu_mem_used_max_mb": 11871.0, "gpu_util_device_mean_max_pct": 65.22, "gpu_util_device_mean_min_pct": 65.22, "gpu_util_max_pct": 100.0, "gpu_util_mean_pct": 65.22, "memory_controller_util_max_pct": 82.0, "memory_controller_util_mean_pct": 43.12, "meta_json_path": "/workspace/parameter-golf/logs/h100_phase1b_lane2/h100_logit_softcap_20.telemetry_meta.json", "power_max_w": 530.5, "power_mean_w": 360.89, "proc_snapshot_log": "/workspace/parameter-golf/logs/h100_phase1b_lane2/h100_logit_softcap_20.proc_snapshots.log", "telemetry_samples": 68, "temperature_max_c": 44.0, "vram_used_device_mean_max_pct": 14.14, "vram_used_device_mean_min_pct": 14.14, "vram_used_max_pct": 14.56, "vram_used_mean_pct": 14.14}, "tok_s": 1048156.74, "tok_s_per_gpu": 1048156.74, "train_batch_tokens": 524288, "train_microbatch_tokens_per_gpu": 65536, "train_seq_len": 1024, "train_time_ms": 600239, "val_bpb": 1.34715364, "val_loss": 2.2746125, "warmup_steps": 20, "world_size": 1}
{"batch": "phase_1_knobs_b", "bytes_model_int8_zlib": 13034933, "bytes_total_int8_zlib": 13083473, "category": "hparam_schedule", "command": "SEED=1337 LOGIT_SOFTCAP=40 torchrun --standalone --nproc_per_node=1 train_gpt.py", "decision": "discard", "delta_vs_baseline": 0.00321233, "delta_vs_parent": 0.00321233, "description": "Logit softcap 40", "duration_seconds": 600.334, "env_overrides": {"LOGIT_SOFTCAP": "40", "SEED": "1337"}, "exit_code": 0, "final_eval_time_ms": 12239, "finished_at": "2026-04-22T09:12:44Z", "grad_accum_steps": 8, "iterations": 20000, "max_wallclock_seconds": 600.0, "model_params": 17059912, "notes": "regresses vs baseline", "parent_recipe": "h100_baseline_sp1024", "path_log": "/workspace/parameter-golf/logs/h100_phase1b_lane2/h100_logit_softcap_40.log", "peak_memory_allocated_mib": 10239, "peak_memory_reserved_mib": 10554, "priority": 1, "run_id": "h100_logit_softcap_40", "seed": 1337, "started_at": "2026-04-22T09:01:23Z", "status": "discard", "step": 1163, "step_avg_ms": 516.19, "telemetry": {"gpu_count": 1, "gpu_csv_path": "/workspace/parameter-golf/logs/h100_phase1b_lane2/h100_logit_softcap_40.nvidia_smi.csv", "gpu_mem_total_mb": 81559.0, "gpu_mem_used_max_mb": 11871.0, "gpu_util_device_mean_max_pct": 65.85, "gpu_util_device_mean_min_pct": 65.85, "gpu_util_max_pct": 100.0, "gpu_util_mean_pct": 65.85, "memory_controller_util_max_pct": 70.0, "memory_controller_util_mean_pct": 43.06, "meta_json_path": "/workspace/parameter-golf/logs/h100_phase1b_lane2/h100_logit_softcap_40.telemetry_meta.json", "power_max_w": 533.25, "power_mean_w": 365.23, "proc_snapshot_log": "/workspace/parameter-golf/logs/h100_phase1b_lane2/h100_logit_softcap_40.proc_snapshots.log", "telemetry_samples": 65, "temperature_max_c": 46.0, "vram_used_device_mean_max_pct": 14.12, "vram_used_device_mean_min_pct": 14.12, "vram_used_max_pct": 14.56, "vram_used_mean_pct": 14.12}, "tok_s": 1015688.02, "tok_s_per_gpu": 1015688.02, "train_batch_tokens": 524288, "train_microbatch_tokens_per_gpu": 65536, "train_seq_len": 1024, "train_time_ms": 600334, "val_bpb": 1.34538256, "val_loss": 2.27162209, "warmup_steps": 20, "world_size": 1}
